2026-02-27 01:11:54,272 - INFO - 脚本开始运行
2026-02-27 01:11:54,272 - INFO - 解析得到 42 个 tracker URLs
2026-02-27 01:11:54,273 - INFO - 从 bt-site.txt 读取了 1262 个现有条目
2026-02-27 01:11:54,273 - INFO - 从 bt-ip.txt 读取了 929 个现有条目
2026-02-27 01:11:54,273 - INFO - 开始下载: https://api.yaozuopan.top:88/composite?key=bt&auth=3cae9a3a53f1daef137126648a535ab7
2026-02-27 01:11:56,200 - INFO - 下载成功: https://api.yaozuopan.top:88/composite?key=bt&auth=3cae9a3a53f1daef137126648a535ab7 (状态码: 200, 类型: application/json; charset=utf-8)
2026-02-27 01:11:56,200 - WARNING - URL 返回了非列表的 JSON (<class 'dict'>)，回退到文本处理: https://api.yaozuopan.top:88/composite?key=bt&auth=3cae9a3a53f1daef137126648a535ab7
2026-02-27 01:11:56,201 - INFO - 从 https://api.yaozuopan.top:88/composite?key=bt&auth=3cae9a3a53f1daef137126648a535ab7 提取了 1 个唯一有效条目 (JSON尝试: True)
2026-02-27 01:11:56,201 - INFO - 开始下载: https://www.gbsat.org/bt/tracker.txt
2026-02-27 01:11:56,488 - INFO - 下载成功: https://www.gbsat.org/bt/tracker.txt (状态码: 200, 类型: text/plain)
2026-02-27 01:11:56,489 - INFO - 从 https://www.gbsat.org/bt/tracker.txt 提取了 216 个唯一有效条目 (JSON尝试: False)
2026-02-27 01:11:56,490 - INFO - 开始下载: https://github.com/XIU2/TrackersListCollection/raw/master/all.txt
2026-02-27 01:11:56,866 - INFO - 下载成功: https://github.com/XIU2/TrackersListCollection/raw/master/all.txt (状态码: 200, 类型: text/plain; charset=utf-8)
2026-02-27 01:11:56,866 - INFO - 从 https://github.com/XIU2/TrackersListCollection/raw/master/all.txt 提取了 149 个唯一有效条目 (JSON尝试: False)
2026-02-27 01:11:56,868 - INFO - 开始下载: https://raw.githubusercontent.com/Tunglies/TrackersList/refs/heads/main/all.txt
2026-02-27 01:11:56,993 - INFO - 下载成功: https://raw.githubusercontent.com/Tunglies/TrackersList/refs/heads/main/all.txt (状态码: 200, 类型: text/plain; charset=utf-8)
2026-02-27 01:11:56,998 - INFO - 从 https://raw.githubusercontent.com/Tunglies/TrackersList/refs/heads/main/all.txt 提取了 1534 个唯一有效条目 (JSON尝试: False)
2026-02-27 01:11:56,998 - INFO - 开始下载: https://github.com/XIU2/TrackersListCollection/raw/master/all_aria2.txt
2026-02-27 01:11:57,418 - INFO - 下载成功: https://github.com/XIU2/TrackersListCollection/raw/master/all_aria2.txt (状态码: 200, 类型: text/plain; charset=utf-8)
2026-02-27 01:11:57,418 - INFO - 从 https://github.com/XIU2/TrackersListCollection/raw/master/all_aria2.txt 提取了 149 个唯一有效条目 (JSON尝试: False)
2026-02-27 01:11:57,420 - INFO - 开始下载: https://github.com/XIU2/TrackersListCollection/raw/master/best.txt
2026-02-27 01:11:57,819 - INFO - 下载成功: https://github.com/XIU2/TrackersListCollection/raw/master/best.txt (状态码: 200, 类型: text/plain; charset=utf-8)
2026-02-27 01:11:57,820 - INFO - 从 https://github.com/XIU2/TrackersListCollection/raw/master/best.txt 提取了 74 个唯一有效条目 (JSON尝试: False)
2026-02-27 01:11:57,821 - INFO - 开始下载: https://github.com/XIU2/TrackersListCollection/raw/master/best_aria2.txt
2026-02-27 01:11:58,265 - INFO - 下载成功: https://github.com/XIU2/TrackersListCollection/raw/master/best_aria2.txt (状态码: 200, 类型: text/plain; charset=utf-8)
2026-02-27 01:11:58,266 - INFO - 从 https://github.com/XIU2/TrackersListCollection/raw/master/best_aria2.txt 提取了 74 个唯一有效条目 (JSON尝试: False)
2026-02-27 01:11:58,268 - INFO - 开始下载: https://github.com/XIU2/TrackersListCollection/raw/master/blacklist.txt
2026-02-27 01:11:58,710 - INFO - 下载成功: https://github.com/XIU2/TrackersListCollection/raw/master/blacklist.txt (状态码: 200, 类型: text/plain; charset=utf-8)
2026-02-27 01:11:58,710 - INFO - 从 https://github.com/XIU2/TrackersListCollection/raw/master/blacklist.txt 提取了 20 个唯一有效条目 (JSON尝试: False)
2026-02-27 01:11:58,712 - INFO - 开始下载: https://github.com/XIU2/TrackersListCollection/raw/master/http.txt
2026-02-27 01:11:59,127 - INFO - 下载成功: https://github.com/XIU2/TrackersListCollection/raw/master/http.txt (状态码: 200, 类型: text/plain; charset=utf-8)
2026-02-27 01:11:59,128 - INFO - 从 https://github.com/XIU2/TrackersListCollection/raw/master/http.txt 提取了 74 个唯一有效条目 (JSON尝试: False)
2026-02-27 01:11:59,129 - INFO - 开始下载: https://github.com/XIU2/TrackersListCollection/raw/master/http_aria2.txt
2026-02-27 01:11:59,590 - INFO - 下载成功: https://github.com/XIU2/TrackersListCollection/raw/master/http_aria2.txt (状态码: 200, 类型: text/plain; charset=utf-8)
2026-02-27 01:11:59,590 - INFO - 从 https://github.com/XIU2/TrackersListCollection/raw/master/http_aria2.txt 提取了 74 个唯一有效条目 (JSON尝试: False)
2026-02-27 01:11:59,592 - INFO - 开始下载: https://github.com/XIU2/TrackersListCollection/raw/master/nohttp.txt
2026-02-27 01:12:00,079 - INFO - 下载成功: https://github.com/XIU2/TrackersListCollection/raw/master/nohttp.txt (状态码: 200, 类型: text/plain; charset=utf-8)
2026-02-27 01:12:00,079 - INFO - 从 https://github.com/XIU2/TrackersListCollection/raw/master/nohttp.txt 提取了 97 个唯一有效条目 (JSON尝试: False)
2026-02-27 01:12:00,082 - INFO - 开始下载: https://github.com/XIU2/TrackersListCollection/raw/master/nohttp_aria2.txt
2026-02-27 01:12:00,533 - INFO - 下载成功: https://github.com/XIU2/TrackersListCollection/raw/master/nohttp_aria2.txt (状态码: 200, 类型: text/plain; charset=utf-8)
2026-02-27 01:12:00,534 - INFO - 从 https://github.com/XIU2/TrackersListCollection/raw/master/nohttp_aria2.txt 提取了 97 个唯一有效条目 (JSON尝试: False)
2026-02-27 01:12:00,536 - INFO - 开始下载: https://github.com/XIU2/TrackersListCollection/raw/master/other.txt
2026-02-27 01:12:00,977 - INFO - 下载成功: https://github.com/XIU2/TrackersListCollection/raw/master/other.txt (状态码: 200, 类型: text/plain; charset=utf-8)
2026-02-27 01:12:00,977 - INFO - 从 https://github.com/XIU2/TrackersListCollection/raw/master/other.txt 提取了 13 个唯一有效条目 (JSON尝试: False)
2026-02-27 01:12:00,978 - INFO - 开始下载: https://cf.trackerslist.com/all.txt
2026-02-27 01:12:01,066 - INFO - 下载成功: https://cf.trackerslist.com/all.txt (状态码: 200, 类型: text/plain; charset=utf-8)
2026-02-27 01:12:01,067 - INFO - 从 https://cf.trackerslist.com/all.txt 提取了 149 个唯一有效条目 (JSON尝试: False)
2026-02-27 01:12:01,068 - INFO - 开始下载: https://cf.trackerslist.com/best.txt
2026-02-27 01:12:01,107 - INFO - 下载成功: https://cf.trackerslist.com/best.txt (状态码: 200, 类型: text/plain; charset=utf-8)
2026-02-27 01:12:01,107 - INFO - 从 https://cf.trackerslist.com/best.txt 提取了 74 个唯一有效条目 (JSON尝试: False)
2026-02-27 01:12:01,108 - INFO - 开始下载: https://cf.trackerslist.com/http.txt
2026-02-27 01:12:01,145 - INFO - 下载成功: https://cf.trackerslist.com/http.txt (状态码: 200, 类型: text/plain; charset=utf-8)
2026-02-27 01:12:01,146 - INFO - 从 https://cf.trackerslist.com/http.txt 提取了 74 个唯一有效条目 (JSON尝试: False)
2026-02-27 01:12:01,147 - INFO - 开始下载: https://cf.trackerslist.com/nohttp.txt
2026-02-27 01:12:01,191 - INFO - 下载成功: https://cf.trackerslist.com/nohttp.txt (状态码: 200, 类型: text/plain; charset=utf-8)
2026-02-27 01:12:01,191 - INFO - 从 https://cf.trackerslist.com/nohttp.txt 提取了 97 个唯一有效条目 (JSON尝试: False)
2026-02-27 01:12:01,192 - INFO - 开始下载: https://github.com/ngosang/trackerslist/raw/master/blacklist.txt
2026-02-27 01:12:01,625 - INFO - 下载成功: https://github.com/ngosang/trackerslist/raw/master/blacklist.txt (状态码: 200, 类型: text/plain; charset=utf-8)
2026-02-27 01:12:01,627 - INFO - 从 https://github.com/ngosang/trackerslist/raw/master/blacklist.txt 提取了 342 个唯一有效条目 (JSON尝试: False)
2026-02-27 01:12:01,629 - INFO - 开始下载: https://raw.githubusercontent.com/ngosang/trackerslist/master/trackers_best.txt
2026-02-27 01:12:01,659 - INFO - 下载成功: https://raw.githubusercontent.com/ngosang/trackerslist/master/trackers_best.txt (状态码: 200, 类型: text/plain; charset=utf-8)
2026-02-27 01:12:01,659 - INFO - 从 https://raw.githubusercontent.com/ngosang/trackerslist/master/trackers_best.txt 提取了 20 个唯一有效条目 (JSON尝试: False)
2026-02-27 01:12:01,659 - INFO - 开始下载: https://raw.githubusercontent.com/ngosang/trackerslist/master/trackers_all.txt
2026-02-27 01:12:01,775 - INFO - 下载成功: https://raw.githubusercontent.com/ngosang/trackerslist/master/trackers_all.txt (状态码: 200, 类型: text/plain; charset=utf-8)
2026-02-27 01:12:01,776 - INFO - 从 https://raw.githubusercontent.com/ngosang/trackerslist/master/trackers_all.txt 提取了 116 个唯一有效条目 (JSON尝试: False)
2026-02-27 01:12:01,776 - INFO - 开始下载: https://raw.githubusercontent.com/ngosang/trackerslist/master/trackers_all_udp.txt
2026-02-27 01:12:01,806 - INFO - 下载成功: https://raw.githubusercontent.com/ngosang/trackerslist/master/trackers_all_udp.txt (状态码: 200, 类型: text/plain; charset=utf-8)
2026-02-27 01:12:01,807 - INFO - 从 https://raw.githubusercontent.com/ngosang/trackerslist/master/trackers_all_udp.txt 提取了 53 个唯一有效条目 (JSON尝试: False)
2026-02-27 01:12:01,807 - INFO - 开始下载: https://raw.githubusercontent.com/ngosang/trackerslist/master/trackers_all_http.txt
2026-02-27 01:12:01,910 - INFO - 下载成功: https://raw.githubusercontent.com/ngosang/trackerslist/master/trackers_all_http.txt (状态码: 200, 类型: text/plain; charset=utf-8)
2026-02-27 01:12:01,910 - INFO - 从 https://raw.githubusercontent.com/ngosang/trackerslist/master/trackers_all_http.txt 提取了 49 个唯一有效条目 (JSON尝试: False)
2026-02-27 01:12:01,911 - INFO - 开始下载: https://raw.githubusercontent.com/ngosang/trackerslist/master/trackers_all_https.txt
2026-02-27 01:12:02,026 - INFO - 下载成功: https://raw.githubusercontent.com/ngosang/trackerslist/master/trackers_all_https.txt (状态码: 200, 类型: text/plain; charset=utf-8)
2026-02-27 01:12:02,026 - INFO - 从 https://raw.githubusercontent.com/ngosang/trackerslist/master/trackers_all_https.txt 提取了 14 个唯一有效条目 (JSON尝试: False)
2026-02-27 01:12:02,027 - INFO - 开始下载: https://raw.githubusercontent.com/ngosang/trackerslist/master/trackers_all_ws.txt
2026-02-27 01:12:02,135 - INFO - 下载成功: https://raw.githubusercontent.com/ngosang/trackerslist/master/trackers_all_ws.txt (状态码: 200, 类型: text/plain; charset=utf-8)
2026-02-27 01:12:02,136 - INFO - 从 https://raw.githubusercontent.com/ngosang/trackerslist/master/trackers_all_ws.txt 提取了 2 个唯一有效条目 (JSON尝试: False)
2026-02-27 01:12:02,137 - INFO - 开始下载: https://raw.githubusercontent.com/ngosang/trackerslist/master/trackers_best_ip.txt
2026-02-27 01:12:02,233 - INFO - 下载成功: https://raw.githubusercontent.com/ngosang/trackerslist/master/trackers_best_ip.txt (状态码: 200, 类型: text/plain; charset=utf-8)
2026-02-27 01:12:02,233 - INFO - 从 https://raw.githubusercontent.com/ngosang/trackerslist/master/trackers_best_ip.txt 提取了 20 个唯一有效条目 (JSON尝试: False)
2026-02-27 01:12:02,234 - INFO - 开始下载: https://raw.githubusercontent.com/ngosang/trackerslist/master/trackers_all_ip.txt
2026-02-27 01:12:02,266 - INFO - 下载成功: https://raw.githubusercontent.com/ngosang/trackerslist/master/trackers_all_ip.txt (状态码: 200, 类型: text/plain; charset=utf-8)
2026-02-27 01:12:02,266 - INFO - 从 https://raw.githubusercontent.com/ngosang/trackerslist/master/trackers_all_ip.txt 提取了 71 个唯一有效条目 (JSON尝试: False)
2026-02-27 01:12:02,267 - INFO - 开始下载: https://newtrackon.com/api/all
2026-02-27 01:12:02,524 - INFO - 下载成功: https://newtrackon.com/api/all (状态码: 200, 类型: text/plain; charset=utf-8)
2026-02-27 01:12:02,525 - WARNING - URL https://newtrackon.com/api/all 检测到 JSON 类型但解析失败，将尝试文本分割。
2026-02-27 01:12:02,526 - INFO - 从 https://newtrackon.com/api/all 提取了 252 个唯一有效条目 (JSON尝试: True)
2026-02-27 01:12:02,527 - INFO - 开始下载: https://raw.githubusercontent.com/Anshuman8/open-trackers-list/master/trackers.txt
2026-02-27 01:12:02,629 - ERROR - 下载失败: https://raw.githubusercontent.com/Anshuman8/open-trackers-list/master/trackers.txt - 404 Client Error: Not Found for url: https://raw.githubusercontent.com/Anshuman8/open-trackers-list/master/trackers.txt
2026-02-27 01:12:02,629 - INFO - 从 https://raw.githubusercontent.com/Anshuman8/open-trackers-list/master/trackers.txt 提取了 0 个唯一有效条目 (JSON尝试: False)
2026-02-27 01:12:02,630 - INFO - 开始下载: https://raw.githubusercontent.com/adysec/tracker/refs/heads/main/trackers_all.txt
2026-02-27 01:12:02,779 - INFO - 下载成功: https://raw.githubusercontent.com/adysec/tracker/refs/heads/main/trackers_all.txt (状态码: 200, 类型: text/plain; charset=utf-8)
2026-02-27 01:12:02,788 - INFO - 从 https://raw.githubusercontent.com/adysec/tracker/refs/heads/main/trackers_all.txt 提取了 3167 个唯一有效条目 (JSON尝试: False)
2026-02-27 01:12:02,789 - INFO - 开始下载: https://raw.githubusercontent.com/adysec/tracker/refs/heads/main/trackers_best.txt
2026-02-27 01:12:03,021 - INFO - 下载成功: https://raw.githubusercontent.com/adysec/tracker/refs/heads/main/trackers_best.txt (状态码: 200, 类型: text/plain; charset=utf-8)
2026-02-27 01:12:03,025 - INFO - 从 https://raw.githubusercontent.com/adysec/tracker/refs/heads/main/trackers_best.txt 提取了 1258 个唯一有效条目 (JSON尝试: False)
2026-02-27 01:12:03,026 - INFO - 开始下载: https://raw.githubusercontent.com/hezhijie0327/Trackerslist/refs/heads/main/trackerslist_exclude.txt
2026-02-27 01:12:03,253 - INFO - 下载成功: https://raw.githubusercontent.com/hezhijie0327/Trackerslist/refs/heads/main/trackerslist_exclude.txt (状态码: 200, 类型: text/plain; charset=utf-8)
2026-02-27 01:12:03,255 - INFO - 从 https://raw.githubusercontent.com/hezhijie0327/Trackerslist/refs/heads/main/trackerslist_exclude.txt 提取了 492 个唯一有效条目 (JSON尝试: False)
2026-02-27 01:12:03,256 - INFO - 开始下载: https://raw.githubusercontent.com/hezhijie0327/Trackerslist/refs/heads/main/trackerslist_combine.txt
2026-02-27 01:12:03,395 - INFO - 下载成功: https://raw.githubusercontent.com/hezhijie0327/Trackerslist/refs/heads/main/trackerslist_combine.txt (状态码: 200, 类型: text/plain; charset=utf-8)
2026-02-27 01:12:03,397 - INFO - 从 https://raw.githubusercontent.com/hezhijie0327/Trackerslist/refs/heads/main/trackerslist_combine.txt 提取了 840 个唯一有效条目 (JSON尝试: False)
2026-02-27 01:12:03,398 - INFO - 开始下载: https://raw.githubusercontent.com/hezhijie0327/Trackerslist/refs/heads/main/trackerslist_tracker.txt
2026-02-27 01:12:03,534 - INFO - 下载成功: https://raw.githubusercontent.com/hezhijie0327/Trackerslist/refs/heads/main/trackerslist_tracker.txt (状态码: 200, 类型: text/plain; charset=utf-8)
2026-02-27 01:12:03,536 - INFO - 从 https://raw.githubusercontent.com/hezhijie0327/Trackerslist/refs/heads/main/trackerslist_tracker.txt 提取了 476 个唯一有效条目 (JSON尝试: False)
2026-02-27 01:12:03,537 - INFO - 开始下载: https://trackerslist.com/all.txt
2026-02-27 01:12:03,575 - INFO - 下载成功: https://trackerslist.com/all.txt (状态码: 200, 类型: text/plain; charset=utf-8)
2026-02-27 01:12:03,576 - INFO - 从 https://trackerslist.com/all.txt 提取了 149 个唯一有效条目 (JSON尝试: False)
2026-02-27 01:12:03,576 - INFO - 开始下载: https://raw.githubusercontent.com/DeSireFire/animeTrackerList/master/AT_all.txt
2026-02-27 01:12:03,692 - INFO - 下载成功: https://raw.githubusercontent.com/DeSireFire/animeTrackerList/master/AT_all.txt (状态码: 200, 类型: text/plain; charset=utf-8)
2026-02-27 01:12:03,695 - INFO - 从 https://raw.githubusercontent.com/DeSireFire/animeTrackerList/master/AT_all.txt 提取了 1091 个唯一有效条目 (JSON尝试: False)
2026-02-27 01:12:03,696 - INFO - 开始下载: https://raw.githubusercontent.com/ngosang/trackerslist/master/trackers_all_ip.txt
2026-02-27 01:12:03,798 - INFO - 下载成功: https://raw.githubusercontent.com/ngosang/trackerslist/master/trackers_all_ip.txt (状态码: 200, 类型: text/plain; charset=utf-8)
2026-02-27 01:12:03,798 - INFO - 从 https://raw.githubusercontent.com/ngosang/trackerslist/master/trackers_all_ip.txt 提取了 71 个唯一有效条目 (JSON尝试: False)
2026-02-27 01:12:03,799 - INFO - 开始下载: https://github.com/user-attachments/files/17001768/trackerlist.txt
2026-02-27 01:12:04,507 - INFO - 下载成功: https://github.com/user-attachments/files/17001768/trackerlist.txt (状态码: 200, 类型: text/plain)
2026-02-27 01:12:04,524 - INFO - 从 https://github.com/user-attachments/files/17001768/trackerlist.txt 提取了 1510 个唯一有效条目 (JSON尝试: False)
2026-02-27 01:12:04,527 - INFO - 开始下载: https://github.com/user-attachments/files/17001767/merged_merged_merged_merged_trackers_all_http.txt
2026-02-27 01:12:05,231 - INFO - 下载成功: https://github.com/user-attachments/files/17001767/merged_merged_merged_merged_trackers_all_http.txt (状态码: 200, 类型: text/plain)
2026-02-27 01:12:05,238 - INFO - 从 https://github.com/user-attachments/files/17001767/merged_merged_merged_merged_trackers_all_http.txt 提取了 1011 个唯一有效条目 (JSON尝试: False)
2026-02-27 01:12:05,239 - INFO - 开始下载: https://jsd.cdn.zzko.cn/gh/XIU2/TrackersListCollection/best.txt
2026-02-27 01:12:08,489 - ERROR - 下载失败: https://jsd.cdn.zzko.cn/gh/XIU2/TrackersListCollection/best.txt - 403 Client Error: Forbidden for url: https://cdn.jsdmirror.com/gh/XIU2/TrackersListCollection/best.txt
2026-02-27 01:12:08,489 - INFO - 从 https://jsd.cdn.zzko.cn/gh/XIU2/TrackersListCollection/best.txt 提取了 0 个唯一有效条目 (JSON尝试: False)
2026-02-27 01:12:08,491 - INFO - 开始下载: https://jsd.cdn.zzko.cn/gh/XIU2/TrackersListCollection/all.txt
2026-02-27 01:12:09,805 - ERROR - 下载失败: https://jsd.cdn.zzko.cn/gh/XIU2/TrackersListCollection/all.txt - 403 Client Error: Forbidden for url: https://cdn.jsdmirror.com/gh/XIU2/TrackersListCollection/all.txt
2026-02-27 01:12:09,805 - INFO - 从 https://jsd.cdn.zzko.cn/gh/XIU2/TrackersListCollection/all.txt 提取了 0 个唯一有效条目 (JSON尝试: False)
2026-02-27 01:12:09,806 - INFO - 开始下载: https://jsd.cdn.zzko.cn/gh/XIU2/TrackersListCollection/http.txt
2026-02-27 01:12:11,819 - INFO - 下载成功: https://jsd.cdn.zzko.cn/gh/XIU2/TrackersListCollection/http.txt (状态码: 200, 类型: text/plain; charset=utf-8)
2026-02-27 01:12:11,819 - INFO - 从 https://jsd.cdn.zzko.cn/gh/XIU2/TrackersListCollection/http.txt 提取了 83 个唯一有效条目 (JSON尝试: False)
2026-02-27 01:12:11,821 - INFO - 开始下载: https://trackers.run/s/wp_up_hp_hs_v4_v6.txt
2026-02-27 01:12:12,771 - INFO - 下载成功: https://trackers.run/s/wp_up_hp_hs_v4_v6.txt (状态码: 200, 类型: text/plain; charset=utf-8)
2026-02-27 01:12:12,772 - INFO - 从 https://trackers.run/s/wp_up_hp_hs_v4_v6.txt 提取了 61 个唯一有效条目 (JSON尝试: False)
2026-02-27 01:12:12,774 - INFO - 总共收集到 14114 个原始条目，去重后 3809 个唯一原始条目
2026-02-27 01:12:13,067 - INFO - 检测到并移除隐式端口 '00' from hostname 'laxclax.ddns.net00'. 使用: 'laxclax.ddns.net' (来自: http://laxclax.ddns.net00/announce)
2026-02-27 01:12:13,069 - INFO - 检测到并移除隐式端口 '00' from hostname 'jsb.by00'. 使用: 'jsb.by' (来自: http://jsb.by00/announce)
2026-02-27 01:12:13,070 - WARNING - 清理后的主机名 'opentracker.eeptorrent.i2p' 不符合基本域名结构 (来自: http://opentracker.eeptorrent.i2p:80/a)
2026-02-27 01:12:13,073 - WARNING - 清理后的主机名 '4olv65sj4ifeak26wqiifr3q2vjv5d44x733ncqhtd7cmjwoinpa.b32.i2p' 不符合基本域名结构 (来自: http://4olv65sj4ifeak26wqiifr3q2vjv5d44x733ncqhtd7cmjwoinpa.b32.i2p/announce)
2026-02-27 01:12:13,079 - INFO - 检测到并移除隐式端口 '80' from hostname 'torrentsmd.com80'. 使用: 'torrentsmd.com' (来自: http://torrentsmd.com80/announce)
2026-02-27 01:12:13,080 - WARNING - 清理后的主机名 'opentracker.simp.i2p' 不符合基本域名结构 (来自: http://opentracker.simp.i2p:80/a)
2026-02-27 01:12:13,081 - WARNING - 清理后的主机名 'tracker_proxy' 不符合基本域名结构 (来自: udp://tracker_proxy:63/announce)
2026-02-27 01:12:13,081 - INFO - 检测到并移除隐式端口 '80' from hostname 'tracker3.ctix.cn80'. 使用: 'tracker3.ctix.cn' (来自: http://tracker3.ctix.cn80/announce)
2026-02-27 01:12:13,083 - WARNING - 清理后的主机名 'tracker_proxy' 不符合基本域名结构 (来自: udp://tracker_proxy:62/announce)
2026-02-27 01:12:13,084 - WARNING - 清理后的主机名 'tracker_proxy' 不符合基本域名结构 (来自: udp://tracker_proxy:65/announce)
2026-02-27 01:12:13,086 - WARNING - 清理后的主机名 'tracker_proxy' 不符合基本域名结构 (来自: udp://tracker_proxy:58/announce)
2026-02-27 01:12:13,086 - WARNING - 清理后的主机名 'tracker_proxy' 不符合基本域名结构 (来自: udp://tracker_proxy:61/announce)
2026-02-27 01:12:13,089 - WARNING - 清理后的主机名 '{"message"' 不符合基本域名结构 (来自: {"message":)
2026-02-27 01:12:13,091 - INFO - 检测到并移除隐式端口 '80' from hostname 'tracker.renfei.net80'. 使用: 'tracker.renfei.net' (来自: http://tracker.renfei.net80/announce)
2026-02-27 01:12:13,092 - INFO - 检测到并移除隐式端口 '00' from hostname 'bt.ali213.net00'. 使用: 'bt.ali213.net' (来自: http://bt.ali213.net00/announce)
2026-02-27 01:12:13,096 - WARNING - 清理后的主机名 'tracker_proxy' 不符合基本域名结构 (来自: udp://tracker_proxy:56/announce)
2026-02-27 01:12:13,096 - WARNING - 清理后的主机名 'opentracker.dg2.i2p' 不符合基本域名结构 (来自: http://opentracker.dg2.i2p:80/a)
2026-02-27 01:12:13,137 - WARNING - 清理后的主机名 'tracker_proxy' 不符合基本域名结构 (来自: udp://tracker_proxy:67/announce)
2026-02-27 01:12:13,138 - INFO - 检测到并移除隐式端口 '80' from hostname 'tracker.minglong.org80'. 使用: 'tracker.minglong.org' (来自: http://tracker.minglong.org80/announce)
2026-02-27 01:12:13,139 - WARNING - 清理后的主机名 'tracker_proxy' 不符合基本域名结构 (来自: udp://tracker_proxy:57/announce)
2026-02-27 01:12:13,140 - INFO - 检测到并移除隐式端口 '80' from hostname 'share.camoe.cn80'. 使用: 'share.camoe.cn' (来自: http://share.camoe.cn80/announce)
2026-02-27 01:12:13,143 - WARNING - 清理后的主机名 'tracker_proxy' 不符合基本域名结构 (来自: udp://tracker_proxy:66/announce)
2026-02-27 01:12:13,143 - WARNING - 清理后的主机名 'tracker_proxy' 不符合基本域名结构 (来自: udp://tracker_proxy:68/announce)
2026-02-27 01:12:13,145 - WARNING - 清理后的主机名 'qimlze77z7w32lx2ntnwkuqslrzlsqy7774v3urueuarafyqik5a.b32.i2p' 不符合基本域名结构 (来自: http://qimlze77z7w32lx2ntnwkuqslrzlsqy7774v3urueuarafyqik5a.b32.i2p:80/a)
2026-02-27 01:12:13,148 - INFO - 检测到并移除隐式端口 '80' from hostname 'tracker.ali213.net80'. 使用: 'tracker.ali213.net' (来自: http://tracker.ali213.net80/announce)
2026-02-27 01:12:13,149 - INFO - 检测到并移除隐式端口 '80' from hostname 'www.chouchou.club80'. 使用: 'www.chouchou.club' (来自: http://www.chouchou.club80/announce)
2026-02-27 01:12:13,150 - INFO - 检测到并移除隐式端口 '70' from hostname 'tr.cili001.com70'. 使用: 'tr.cili001.com' (来自: http://tr.cili001.com70/announce)
2026-02-27 01:12:13,151 - WARNING - 清理后的主机名 'opentracker.fattydove.i2p' 不符合基本域名结构 (来自: http://opentracker.fattydove.i2p:80/a)
2026-02-27 01:12:13,152 - WARNING - 清理后的主机名 'opentracker.r4sas.i2p' 不符合基本域名结构 (来自: http://opentracker.r4sas.i2p:80/a)
2026-02-27 01:12:13,157 - WARNING - 检测到嵌套协议，尝试提取内部 URL: 'udp://http://www.peckservers.com:9000/announce'
2026-02-27 01:12:13,161 - INFO - 检测到并移除隐式端口 '80' from hostname 'montreal.nyap2p.com80'. 使用: 'montreal.nyap2p.com' (来自: http://montreal.nyap2p.com80/announce)
2026-02-27 01:12:13,161 - INFO - 检测到并移除隐式端口 '80' from hostname 'bt.ali213.net80'. 使用: 'bt.ali213.net' (来自: http://bt.ali213.net80/announce)
2026-02-27 01:12:13,162 - WARNING - 清理后的主机名 'tracker_proxy' 不符合基本域名结构 (来自: udp://tracker_proxy:59/announce)
2026-02-27 01:12:13,163 - WARNING - 清理后的主机名 'tracker_proxy' 不符合基本域名结构 (来自: udp://tracker_proxy:64/announce)
2026-02-27 01:12:13,169 - WARNING - 清理后的主机名 'opentracker.skank.i2p' 不符合基本域名结构 (来自: udp://opentracker.skank.i2p:6969/a)
2026-02-27 01:12:13,173 - WARNING - 清理后的主机名 'sigmatracker.i2p' 不符合基本域名结构 (来自: http://sigmatracker.i2p:80/a)
2026-02-27 01:12:13,174 - INFO - 检测到并移除隐式端口 '80' from hostname 'bt2.54new.com80'. 使用: 'bt2.54new.com' (来自: http://bt2.54new.com80/announce)
2026-02-27 01:12:13,177 - WARNING - 清理后的主机名 '6wbrmd4wodeewdykfw362gmlbeo26njc5zmtuxdvtomehpozzjja.b32.i2p' 不符合基本域名结构 (来自: http://6wbrmd4wodeewdykfw362gmlbeo26njc5zmtuxdvtomehpozzjja.b32.i2p:80/announce)
2026-02-27 01:12:13,178 - WARNING - 清理后的主机名 'tracker2.postman.i2p' 不符合基本域名结构 (来自: http://tracker2.postman.i2p/announce.php)
2026-02-27 01:12:13,181 - INFO - 检测到并移除隐式端口 '80' from hostname 'tracker1.itzmx.com80'. 使用: 'tracker1.itzmx.com' (来自: http://tracker1.itzmx.com80/announce)
2026-02-27 01:12:13,181 - WARNING - 清理后的主机名 'opentracker.simp.i2p' 不符合基本域名结构 (来自: udp://opentracker.simp.i2p:6969/a)
2026-02-27 01:12:13,182 - INFO - 检测到并移除隐式端口 '80' from hostname 'www.loushao.net80'. 使用: 'www.loushao.net' (来自: http://www.loushao.net80/announce)
2026-02-27 01:12:13,182 - INFO - 检测到并移除隐式端口 '00' from hostname 'tracker.merded.xyz00'. 使用: 'tracker.merded.xyz' (来自: http://tracker.merded.xyz00/announce)
2026-02-27 01:12:13,182 - WARNING - 清理后的主机名 '4olv65sj4ifeak26wqiifr3q2vjv5d44x733ncqhtd7cmjwoinpa.b32.i2p' 不符合基本域名结构 (来自: http://4olv65sj4ifeak26wqiifr3q2vjv5d44x733ncqhtd7cmjwoinpa.b32.i2p:80/announce)
2026-02-27 01:12:13,183 - WARNING - 清理后的主机名 'opentracker.skank.i2p' 不符合基本域名结构 (来自: http://opentracker.skank.i2p:80/a)
2026-02-27 01:12:13,184 - WARNING - 清理后的主机名 '6wbrmd4wodeewdykfw362gmlbeo26njc5zmtuxdvtomehpozzjja.b32.i2p' 不符合基本域名结构 (来自: http://6wbrmd4wodeewdykfw362gmlbeo26njc5zmtuxdvtomehpozzjja.b32.i2p/announce)
2026-02-27 01:12:13,185 - INFO - 检测到并移除隐式端口 '00' from hostname 'tracker.dmhy.org00'. 使用: 'tracker.dmhy.org' (来自: http://tracker.dmhy.org00/announce)
2026-02-27 01:12:13,186 - INFO - 检测到并移除隐式端口 '00' from hostname 'frp.v2fy.com00'. 使用: 'frp.v2fy.com' (来自: http://frp.v2fy.com00/announce)
2026-02-27 01:12:13,187 - INFO - 检测到并移除隐式端口 '00' from hostname 'tracker.ali213.net00'. 使用: 'tracker.ali213.net' (来自: http://tracker.ali213.net00/announce)
2026-02-27 01:12:13,192 - WARNING - 清理后的主机名 'tracker_proxy' 不符合基本域名结构 (来自: udp://tracker_proxy:60/announce)
2026-02-27 01:12:13,193 - INFO - 处理完成 3809 个唯一原始条目
2026-02-27 01:12:13,193 - INFO - 本次运行提取到 1264 个唯一域名和 930 个唯一 IP 地址
2026-02-27 01:12:13,193 - INFO - 发现 2 个新域名
2026-02-27 01:12:13,193 - INFO - 发现 3 个新 IP 地址
2026-02-27 01:12:13,193 - INFO - 向 bt-site.txt 增量添加了 2 个条目
2026-02-27 01:12:13,193 - INFO - 向 bt-ip.txt 增量添加了 3 个条目
2026-02-27 01:12:13,194 - INFO - 成功覆盖写入 bt-site.json (包含 1264 条目)
2026-02-27 01:12:13,194 - INFO - 成功覆盖写入 bt-ip.json (包含 932 条目)
2026-02-27 01:12:13,194 - INFO - --- 运行总结 ---
2026-02-27 01:12:13,194 - INFO - --- 运行总结 (2026-02-27 01:12:13) ---
2026-02-27 01:12:13,195 - INFO - 总耗时: 0:00:18
2026-02-27 01:12:13,195 - INFO - 处理的 URL 数量: 42
2026-02-27 01:12:13,195 - INFO - 收集的原始条目数: 14114 (3809 unique)
2026-02-27 01:12:13,195 - INFO - 提取的唯一域名数 (本次): 2 (总计: 1264)
2026-02-27 01:12:13,195 - INFO -   新增域名: [bittorrent.kali.org, node02.madtia.cc]
2026-02-27 01:12:13,195 - INFO - 提取的唯一 IP 地址数 (本次): 3 (总计: 932)
2026-02-27 01:12:13,195 - INFO -   新增 IP: [193.187.90.12, 117.84.154.98, 187.56.163.25]
2026-02-27 01:12:13,195 - INFO - -------------------------------------
2026-02-27 01:12:13,195 - INFO - 脚本运行成功结束
