2026-02-13 01:20:15,023 - INFO - 脚本开始运行
2026-02-13 01:20:15,023 - INFO - 解析得到 42 个 tracker URLs
2026-02-13 01:20:15,023 - INFO - 从 bt-site.txt 读取了 1247 个现有条目
2026-02-13 01:20:15,024 - INFO - 从 bt-ip.txt 读取了 915 个现有条目
2026-02-13 01:20:15,024 - INFO - 开始下载: https://api.yaozuopan.top:88/composite?key=bt&auth=3cae9a3a53f1daef137126648a535ab7
2026-02-13 01:20:16,882 - INFO - 下载成功: https://api.yaozuopan.top:88/composite?key=bt&auth=3cae9a3a53f1daef137126648a535ab7 (状态码: 200, 类型: application/json; charset=utf-8)
2026-02-13 01:20:16,882 - WARNING - URL 返回了非列表的 JSON (<class 'dict'>)，回退到文本处理: https://api.yaozuopan.top:88/composite?key=bt&auth=3cae9a3a53f1daef137126648a535ab7
2026-02-13 01:20:16,882 - INFO - 从 https://api.yaozuopan.top:88/composite?key=bt&auth=3cae9a3a53f1daef137126648a535ab7 提取了 1 个唯一有效条目 (JSON尝试: True)
2026-02-13 01:20:16,883 - INFO - 开始下载: https://www.gbsat.org/bt/tracker.txt
2026-02-13 01:20:17,154 - INFO - 下载成功: https://www.gbsat.org/bt/tracker.txt (状态码: 200, 类型: text/plain)
2026-02-13 01:20:17,155 - INFO - 从 https://www.gbsat.org/bt/tracker.txt 提取了 216 个唯一有效条目 (JSON尝试: False)
2026-02-13 01:20:17,156 - INFO - 开始下载: https://github.com/XIU2/TrackersListCollection/raw/master/all.txt
2026-02-13 01:20:17,509 - INFO - 下载成功: https://github.com/XIU2/TrackersListCollection/raw/master/all.txt (状态码: 200, 类型: text/plain; charset=utf-8)
2026-02-13 01:20:17,510 - INFO - 从 https://github.com/XIU2/TrackersListCollection/raw/master/all.txt 提取了 150 个唯一有效条目 (JSON尝试: False)
2026-02-13 01:20:17,512 - INFO - 开始下载: https://raw.githubusercontent.com/Tunglies/TrackersList/refs/heads/main/all.txt
2026-02-13 01:20:17,725 - INFO - 下载成功: https://raw.githubusercontent.com/Tunglies/TrackersList/refs/heads/main/all.txt (状态码: 200, 类型: text/plain; charset=utf-8)
2026-02-13 01:20:17,729 - INFO - 从 https://raw.githubusercontent.com/Tunglies/TrackersList/refs/heads/main/all.txt 提取了 1517 个唯一有效条目 (JSON尝试: False)
2026-02-13 01:20:17,730 - INFO - 开始下载: https://github.com/XIU2/TrackersListCollection/raw/master/all_aria2.txt
2026-02-13 01:20:18,089 - INFO - 下载成功: https://github.com/XIU2/TrackersListCollection/raw/master/all_aria2.txt (状态码: 200, 类型: text/plain; charset=utf-8)
2026-02-13 01:20:18,089 - INFO - 从 https://github.com/XIU2/TrackersListCollection/raw/master/all_aria2.txt 提取了 150 个唯一有效条目 (JSON尝试: False)
2026-02-13 01:20:18,092 - INFO - 开始下载: https://github.com/XIU2/TrackersListCollection/raw/master/best.txt
2026-02-13 01:20:18,473 - INFO - 下载成功: https://github.com/XIU2/TrackersListCollection/raw/master/best.txt (状态码: 200, 类型: text/plain; charset=utf-8)
2026-02-13 01:20:18,473 - INFO - 从 https://github.com/XIU2/TrackersListCollection/raw/master/best.txt 提取了 69 个唯一有效条目 (JSON尝试: False)
2026-02-13 01:20:18,475 - INFO - 开始下载: https://github.com/XIU2/TrackersListCollection/raw/master/best_aria2.txt
2026-02-13 01:20:18,870 - INFO - 下载成功: https://github.com/XIU2/TrackersListCollection/raw/master/best_aria2.txt (状态码: 200, 类型: text/plain; charset=utf-8)
2026-02-13 01:20:18,871 - INFO - 从 https://github.com/XIU2/TrackersListCollection/raw/master/best_aria2.txt 提取了 69 个唯一有效条目 (JSON尝试: False)
2026-02-13 01:20:18,872 - INFO - 开始下载: https://github.com/XIU2/TrackersListCollection/raw/master/blacklist.txt
2026-02-13 01:20:19,260 - INFO - 下载成功: https://github.com/XIU2/TrackersListCollection/raw/master/blacklist.txt (状态码: 200, 类型: text/plain; charset=utf-8)
2026-02-13 01:20:19,261 - INFO - 从 https://github.com/XIU2/TrackersListCollection/raw/master/blacklist.txt 提取了 20 个唯一有效条目 (JSON尝试: False)
2026-02-13 01:20:19,262 - INFO - 开始下载: https://github.com/XIU2/TrackersListCollection/raw/master/http.txt
2026-02-13 01:20:19,632 - INFO - 下载成功: https://github.com/XIU2/TrackersListCollection/raw/master/http.txt (状态码: 200, 类型: text/plain; charset=utf-8)
2026-02-13 01:20:19,632 - INFO - 从 https://github.com/XIU2/TrackersListCollection/raw/master/http.txt 提取了 81 个唯一有效条目 (JSON尝试: False)
2026-02-13 01:20:19,634 - INFO - 开始下载: https://github.com/XIU2/TrackersListCollection/raw/master/http_aria2.txt
2026-02-13 01:20:20,017 - INFO - 下载成功: https://github.com/XIU2/TrackersListCollection/raw/master/http_aria2.txt (状态码: 200, 类型: text/plain; charset=utf-8)
2026-02-13 01:20:20,018 - INFO - 从 https://github.com/XIU2/TrackersListCollection/raw/master/http_aria2.txt 提取了 81 个唯一有效条目 (JSON尝试: False)
2026-02-13 01:20:20,019 - INFO - 开始下载: https://github.com/XIU2/TrackersListCollection/raw/master/nohttp.txt
2026-02-13 01:20:20,426 - INFO - 下载成功: https://github.com/XIU2/TrackersListCollection/raw/master/nohttp.txt (状态码: 200, 类型: text/plain; charset=utf-8)
2026-02-13 01:20:20,427 - INFO - 从 https://github.com/XIU2/TrackersListCollection/raw/master/nohttp.txt 提取了 90 个唯一有效条目 (JSON尝试: False)
2026-02-13 01:20:20,428 - INFO - 开始下载: https://github.com/XIU2/TrackersListCollection/raw/master/nohttp_aria2.txt
2026-02-13 01:20:20,848 - INFO - 下载成功: https://github.com/XIU2/TrackersListCollection/raw/master/nohttp_aria2.txt (状态码: 200, 类型: text/plain; charset=utf-8)
2026-02-13 01:20:20,848 - INFO - 从 https://github.com/XIU2/TrackersListCollection/raw/master/nohttp_aria2.txt 提取了 90 个唯一有效条目 (JSON尝试: False)
2026-02-13 01:20:20,850 - INFO - 开始下载: https://github.com/XIU2/TrackersListCollection/raw/master/other.txt
2026-02-13 01:20:21,360 - INFO - 下载成功: https://github.com/XIU2/TrackersListCollection/raw/master/other.txt (状态码: 200, 类型: text/plain; charset=utf-8)
2026-02-13 01:20:21,360 - INFO - 从 https://github.com/XIU2/TrackersListCollection/raw/master/other.txt 提取了 13 个唯一有效条目 (JSON尝试: False)
2026-02-13 01:20:21,362 - INFO - 开始下载: https://cf.trackerslist.com/all.txt
2026-02-13 01:20:21,572 - INFO - 下载成功: https://cf.trackerslist.com/all.txt (状态码: 200, 类型: text/plain; charset=utf-8)
2026-02-13 01:20:21,573 - INFO - 从 https://cf.trackerslist.com/all.txt 提取了 150 个唯一有效条目 (JSON尝试: False)
2026-02-13 01:20:21,574 - INFO - 开始下载: https://cf.trackerslist.com/best.txt
2026-02-13 01:20:21,676 - INFO - 下载成功: https://cf.trackerslist.com/best.txt (状态码: 200, 类型: text/plain; charset=utf-8)
2026-02-13 01:20:21,676 - INFO - 从 https://cf.trackerslist.com/best.txt 提取了 69 个唯一有效条目 (JSON尝试: False)
2026-02-13 01:20:21,677 - INFO - 开始下载: https://cf.trackerslist.com/http.txt
2026-02-13 01:20:21,778 - INFO - 下载成功: https://cf.trackerslist.com/http.txt (状态码: 200, 类型: text/plain; charset=utf-8)
2026-02-13 01:20:21,779 - INFO - 从 https://cf.trackerslist.com/http.txt 提取了 81 个唯一有效条目 (JSON尝试: False)
2026-02-13 01:20:21,780 - INFO - 开始下载: https://cf.trackerslist.com/nohttp.txt
2026-02-13 01:20:21,883 - INFO - 下载成功: https://cf.trackerslist.com/nohttp.txt (状态码: 200, 类型: text/plain; charset=utf-8)
2026-02-13 01:20:21,883 - INFO - 从 https://cf.trackerslist.com/nohttp.txt 提取了 90 个唯一有效条目 (JSON尝试: False)
2026-02-13 01:20:21,884 - INFO - 开始下载: https://github.com/ngosang/trackerslist/raw/master/blacklist.txt
2026-02-13 01:20:22,280 - INFO - 下载成功: https://github.com/ngosang/trackerslist/raw/master/blacklist.txt (状态码: 200, 类型: text/plain; charset=utf-8)
2026-02-13 01:20:22,281 - INFO - 从 https://github.com/ngosang/trackerslist/raw/master/blacklist.txt 提取了 342 个唯一有效条目 (JSON尝试: False)
2026-02-13 01:20:22,282 - INFO - 开始下载: https://raw.githubusercontent.com/ngosang/trackerslist/master/trackers_best.txt
2026-02-13 01:20:22,359 - INFO - 下载成功: https://raw.githubusercontent.com/ngosang/trackerslist/master/trackers_best.txt (状态码: 200, 类型: text/plain; charset=utf-8)
2026-02-13 01:20:22,359 - INFO - 从 https://raw.githubusercontent.com/ngosang/trackerslist/master/trackers_best.txt 提取了 20 个唯一有效条目 (JSON尝试: False)
2026-02-13 01:20:22,360 - INFO - 开始下载: https://raw.githubusercontent.com/ngosang/trackerslist/master/trackers_all.txt
2026-02-13 01:20:22,439 - INFO - 下载成功: https://raw.githubusercontent.com/ngosang/trackerslist/master/trackers_all.txt (状态码: 200, 类型: text/plain; charset=utf-8)
2026-02-13 01:20:22,440 - INFO - 从 https://raw.githubusercontent.com/ngosang/trackerslist/master/trackers_all.txt 提取了 119 个唯一有效条目 (JSON尝试: False)
2026-02-13 01:20:22,440 - INFO - 开始下载: https://raw.githubusercontent.com/ngosang/trackerslist/master/trackers_all_udp.txt
2026-02-13 01:20:22,517 - INFO - 下载成功: https://raw.githubusercontent.com/ngosang/trackerslist/master/trackers_all_udp.txt (状态码: 200, 类型: text/plain; charset=utf-8)
2026-02-13 01:20:22,517 - INFO - 从 https://raw.githubusercontent.com/ngosang/trackerslist/master/trackers_all_udp.txt 提取了 50 个唯一有效条目 (JSON尝试: False)
2026-02-13 01:20:22,518 - INFO - 开始下载: https://raw.githubusercontent.com/ngosang/trackerslist/master/trackers_all_http.txt
2026-02-13 01:20:22,596 - INFO - 下载成功: https://raw.githubusercontent.com/ngosang/trackerslist/master/trackers_all_http.txt (状态码: 200, 类型: text/plain; charset=utf-8)
2026-02-13 01:20:22,597 - INFO - 从 https://raw.githubusercontent.com/ngosang/trackerslist/master/trackers_all_http.txt 提取了 55 个唯一有效条目 (JSON尝试: False)
2026-02-13 01:20:22,597 - INFO - 开始下载: https://raw.githubusercontent.com/ngosang/trackerslist/master/trackers_all_https.txt
2026-02-13 01:20:22,676 - INFO - 下载成功: https://raw.githubusercontent.com/ngosang/trackerslist/master/trackers_all_https.txt (状态码: 200, 类型: text/plain; charset=utf-8)
2026-02-13 01:20:22,676 - INFO - 从 https://raw.githubusercontent.com/ngosang/trackerslist/master/trackers_all_https.txt 提取了 14 个唯一有效条目 (JSON尝试: False)
2026-02-13 01:20:22,676 - INFO - 开始下载: https://raw.githubusercontent.com/ngosang/trackerslist/master/trackers_all_ws.txt
2026-02-13 01:20:22,756 - INFO - 下载成功: https://raw.githubusercontent.com/ngosang/trackerslist/master/trackers_all_ws.txt (状态码: 200, 类型: text/plain; charset=utf-8)
2026-02-13 01:20:22,756 - INFO - 从 https://raw.githubusercontent.com/ngosang/trackerslist/master/trackers_all_ws.txt 提取了 2 个唯一有效条目 (JSON尝试: False)
2026-02-13 01:20:22,757 - INFO - 开始下载: https://raw.githubusercontent.com/ngosang/trackerslist/master/trackers_best_ip.txt
2026-02-13 01:20:22,890 - INFO - 下载成功: https://raw.githubusercontent.com/ngosang/trackerslist/master/trackers_best_ip.txt (状态码: 200, 类型: text/plain; charset=utf-8)
2026-02-13 01:20:22,890 - INFO - 从 https://raw.githubusercontent.com/ngosang/trackerslist/master/trackers_best_ip.txt 提取了 20 个唯一有效条目 (JSON尝试: False)
2026-02-13 01:20:22,891 - INFO - 开始下载: https://raw.githubusercontent.com/ngosang/trackerslist/master/trackers_all_ip.txt
2026-02-13 01:20:22,974 - INFO - 下载成功: https://raw.githubusercontent.com/ngosang/trackerslist/master/trackers_all_ip.txt (状态码: 200, 类型: text/plain; charset=utf-8)
2026-02-13 01:20:22,974 - INFO - 从 https://raw.githubusercontent.com/ngosang/trackerslist/master/trackers_all_ip.txt 提取了 68 个唯一有效条目 (JSON尝试: False)
2026-02-13 01:20:22,975 - INFO - 开始下载: https://newtrackon.com/api/all
2026-02-13 01:20:23,460 - INFO - 下载成功: https://newtrackon.com/api/all (状态码: 200, 类型: text/plain; charset=utf-8)
2026-02-13 01:20:23,460 - WARNING - URL https://newtrackon.com/api/all 检测到 JSON 类型但解析失败，将尝试文本分割。
2026-02-13 01:20:23,461 - INFO - 从 https://newtrackon.com/api/all 提取了 245 个唯一有效条目 (JSON尝试: True)
2026-02-13 01:20:23,462 - INFO - 开始下载: https://raw.githubusercontent.com/Anshuman8/open-trackers-list/master/trackers.txt
2026-02-13 01:20:23,583 - ERROR - 下载失败: https://raw.githubusercontent.com/Anshuman8/open-trackers-list/master/trackers.txt - 404 Client Error: Not Found for url: https://raw.githubusercontent.com/Anshuman8/open-trackers-list/master/trackers.txt
2026-02-13 01:20:23,583 - INFO - 从 https://raw.githubusercontent.com/Anshuman8/open-trackers-list/master/trackers.txt 提取了 0 个唯一有效条目 (JSON尝试: False)
2026-02-13 01:20:23,584 - INFO - 开始下载: https://raw.githubusercontent.com/adysec/tracker/refs/heads/main/trackers_all.txt
2026-02-13 01:20:23,858 - INFO - 下载成功: https://raw.githubusercontent.com/adysec/tracker/refs/heads/main/trackers_all.txt (状态码: 200, 类型: text/plain; charset=utf-8)
2026-02-13 01:20:23,866 - INFO - 从 https://raw.githubusercontent.com/adysec/tracker/refs/heads/main/trackers_all.txt 提取了 3138 个唯一有效条目 (JSON尝试: False)
2026-02-13 01:20:23,867 - INFO - 开始下载: https://raw.githubusercontent.com/adysec/tracker/refs/heads/main/trackers_best.txt
2026-02-13 01:20:24,005 - INFO - 下载成功: https://raw.githubusercontent.com/adysec/tracker/refs/heads/main/trackers_best.txt (状态码: 200, 类型: text/plain; charset=utf-8)
2026-02-13 01:20:24,009 - INFO - 从 https://raw.githubusercontent.com/adysec/tracker/refs/heads/main/trackers_best.txt 提取了 1237 个唯一有效条目 (JSON尝试: False)
2026-02-13 01:20:24,010 - INFO - 开始下载: https://raw.githubusercontent.com/hezhijie0327/Trackerslist/refs/heads/main/trackerslist_exclude.txt
2026-02-13 01:20:24,162 - INFO - 下载成功: https://raw.githubusercontent.com/hezhijie0327/Trackerslist/refs/heads/main/trackerslist_exclude.txt (状态码: 200, 类型: text/plain; charset=utf-8)
2026-02-13 01:20:24,164 - INFO - 从 https://raw.githubusercontent.com/hezhijie0327/Trackerslist/refs/heads/main/trackerslist_exclude.txt 提取了 502 个唯一有效条目 (JSON尝试: False)
2026-02-13 01:20:24,165 - INFO - 开始下载: https://raw.githubusercontent.com/hezhijie0327/Trackerslist/refs/heads/main/trackerslist_combine.txt
2026-02-13 01:20:24,336 - INFO - 下载成功: https://raw.githubusercontent.com/hezhijie0327/Trackerslist/refs/heads/main/trackerslist_combine.txt (状态码: 200, 类型: text/plain; charset=utf-8)
2026-02-13 01:20:24,339 - INFO - 从 https://raw.githubusercontent.com/hezhijie0327/Trackerslist/refs/heads/main/trackerslist_combine.txt 提取了 833 个唯一有效条目 (JSON尝试: False)
2026-02-13 01:20:24,340 - INFO - 开始下载: https://raw.githubusercontent.com/hezhijie0327/Trackerslist/refs/heads/main/trackerslist_tracker.txt
2026-02-13 01:20:24,518 - INFO - 下载成功: https://raw.githubusercontent.com/hezhijie0327/Trackerslist/refs/heads/main/trackerslist_tracker.txt (状态码: 200, 类型: text/plain; charset=utf-8)
2026-02-13 01:20:24,520 - INFO - 从 https://raw.githubusercontent.com/hezhijie0327/Trackerslist/refs/heads/main/trackerslist_tracker.txt 提取了 456 个唯一有效条目 (JSON尝试: False)
2026-02-13 01:20:24,521 - INFO - 开始下载: https://trackerslist.com/all.txt
2026-02-13 01:20:24,736 - INFO - 下载成功: https://trackerslist.com/all.txt (状态码: 200, 类型: text/plain; charset=utf-8)
2026-02-13 01:20:24,737 - INFO - 从 https://trackerslist.com/all.txt 提取了 150 个唯一有效条目 (JSON尝试: False)
2026-02-13 01:20:24,737 - INFO - 开始下载: https://raw.githubusercontent.com/DeSireFire/animeTrackerList/master/AT_all.txt
2026-02-13 01:20:24,816 - INFO - 下载成功: https://raw.githubusercontent.com/DeSireFire/animeTrackerList/master/AT_all.txt (状态码: 200, 类型: text/plain; charset=utf-8)
2026-02-13 01:20:24,819 - INFO - 从 https://raw.githubusercontent.com/DeSireFire/animeTrackerList/master/AT_all.txt 提取了 1091 个唯一有效条目 (JSON尝试: False)
2026-02-13 01:20:24,819 - INFO - 开始下载: https://raw.githubusercontent.com/ngosang/trackerslist/master/trackers_all_ip.txt
2026-02-13 01:20:24,896 - INFO - 下载成功: https://raw.githubusercontent.com/ngosang/trackerslist/master/trackers_all_ip.txt (状态码: 200, 类型: text/plain; charset=utf-8)
2026-02-13 01:20:24,897 - INFO - 从 https://raw.githubusercontent.com/ngosang/trackerslist/master/trackers_all_ip.txt 提取了 68 个唯一有效条目 (JSON尝试: False)
2026-02-13 01:20:24,897 - INFO - 开始下载: https://github.com/user-attachments/files/17001768/trackerlist.txt
2026-02-13 01:20:25,490 - INFO - 下载成功: https://github.com/user-attachments/files/17001768/trackerlist.txt (状态码: 200, 类型: text/plain)
2026-02-13 01:20:25,505 - INFO - 从 https://github.com/user-attachments/files/17001768/trackerlist.txt 提取了 1510 个唯一有效条目 (JSON尝试: False)
2026-02-13 01:20:25,507 - INFO - 开始下载: https://github.com/user-attachments/files/17001767/merged_merged_merged_merged_trackers_all_http.txt
2026-02-13 01:20:26,061 - INFO - 下载成功: https://github.com/user-attachments/files/17001767/merged_merged_merged_merged_trackers_all_http.txt (状态码: 200, 类型: text/plain)
2026-02-13 01:20:26,067 - INFO - 从 https://github.com/user-attachments/files/17001767/merged_merged_merged_merged_trackers_all_http.txt 提取了 1011 个唯一有效条目 (JSON尝试: False)
2026-02-13 01:20:26,069 - INFO - 开始下载: https://jsd.cdn.zzko.cn/gh/XIU2/TrackersListCollection/best.txt
2026-02-13 01:20:29,625 - INFO - 下载成功: https://jsd.cdn.zzko.cn/gh/XIU2/TrackersListCollection/best.txt (状态码: 200, 类型: text/plain; charset=utf-8)
2026-02-13 01:20:29,626 - INFO - 从 https://jsd.cdn.zzko.cn/gh/XIU2/TrackersListCollection/best.txt 提取了 74 个唯一有效条目 (JSON尝试: False)
2026-02-13 01:20:29,627 - INFO - 开始下载: https://jsd.cdn.zzko.cn/gh/XIU2/TrackersListCollection/all.txt
2026-02-13 01:20:31,159 - ERROR - 下载失败: https://jsd.cdn.zzko.cn/gh/XIU2/TrackersListCollection/all.txt - 403 Client Error: Forbidden for url: https://cdn.jsdmirror.com/gh/XIU2/TrackersListCollection/all.txt
2026-02-13 01:20:31,160 - INFO - 从 https://jsd.cdn.zzko.cn/gh/XIU2/TrackersListCollection/all.txt 提取了 0 个唯一有效条目 (JSON尝试: False)
2026-02-13 01:20:31,161 - INFO - 开始下载: https://jsd.cdn.zzko.cn/gh/XIU2/TrackersListCollection/http.txt
2026-02-13 01:20:32,326 - INFO - 下载成功: https://jsd.cdn.zzko.cn/gh/XIU2/TrackersListCollection/http.txt (状态码: 200, 类型: text/plain; charset=utf-8)
2026-02-13 01:20:32,327 - INFO - 从 https://jsd.cdn.zzko.cn/gh/XIU2/TrackersListCollection/http.txt 提取了 71 个唯一有效条目 (JSON尝试: False)
2026-02-13 01:20:32,328 - INFO - 开始下载: https://trackers.run/s/wp_up_hp_hs_v4_v6.txt
2026-02-13 01:20:33,076 - INFO - 下载成功: https://trackers.run/s/wp_up_hp_hs_v4_v6.txt (状态码: 200, 类型: text/plain; charset=utf-8)
2026-02-13 01:20:33,076 - INFO - 从 https://trackers.run/s/wp_up_hp_hs_v4_v6.txt 提取了 53 个唯一有效条目 (JSON尝试: False)
2026-02-13 01:20:33,078 - INFO - 总共收集到 14066 个原始条目，去重后 3774 个唯一原始条目
2026-02-13 01:20:33,235 - INFO - 检测到并移除隐式端口 '80' from hostname 'montreal.nyap2p.com80'. 使用: 'montreal.nyap2p.com' (来自: http://montreal.nyap2p.com80/announce)
2026-02-13 01:20:33,236 - WARNING - 清理后的主机名 'opentracker.simp.i2p' 不符合基本域名结构 (来自: http://opentracker.simp.i2p:80/a)
2026-02-13 01:20:33,419 - WARNING - 清理后的主机名 'sigmatracker.i2p' 不符合基本域名结构 (来自: http://sigmatracker.i2p:80/a)
2026-02-13 01:20:33,421 - INFO - 检测到并移除隐式端口 '00' from hostname 'jsb.by00'. 使用: 'jsb.by' (来自: http://jsb.by00/announce)
2026-02-13 01:20:33,423 - WARNING - 清理后的主机名 'tracker2.postman.i2p' 不符合基本域名结构 (来自: http://tracker2.postman.i2p/announce.php)
2026-02-13 01:20:33,424 - WARNING - 清理后的主机名 'qimlze77z7w32lx2ntnwkuqslrzlsqy7774v3urueuarafyqik5a.b32.i2p' 不符合基本域名结构 (来自: http://qimlze77z7w32lx2ntnwkuqslrzlsqy7774v3urueuarafyqik5a.b32.i2p:80/a)
2026-02-13 01:20:33,424 - WARNING - 检测到嵌套协议，尝试提取内部 URL: 'udp://http://www.peckservers.com:9000/announce'
2026-02-13 01:20:33,426 - WARNING - 清理后的主机名 'tracker_proxy' 不符合基本域名结构 (来自: udp://tracker_proxy:57/announce)
2026-02-13 01:20:33,428 - WARNING - 清理后的主机名 'tracker_proxy' 不符合基本域名结构 (来自: udp://tracker_proxy:59/announce)
2026-02-13 01:20:33,431 - WARNING - 清理后的主机名 '4olv65sj4ifeak26wqiifr3q2vjv5d44x733ncqhtd7cmjwoinpa.b32.i2p' 不符合基本域名结构 (来自: http://4olv65sj4ifeak26wqiifr3q2vjv5d44x733ncqhtd7cmjwoinpa.b32.i2p:80/announce)
2026-02-13 01:20:33,432 - WARNING - 清理后的主机名 'opentracker.eeptorrent.i2p' 不符合基本域名结构 (来自: http://opentracker.eeptorrent.i2p:80/a)
2026-02-13 01:20:33,435 - INFO - 检测到并移除隐式端口 '00' from hostname 'frp.v2fy.com00'. 使用: 'frp.v2fy.com' (来自: http://frp.v2fy.com00/announce)
2026-02-13 01:20:33,438 - INFO - 检测到并移除隐式端口 '00' from hostname 'tracker.ali213.net00'. 使用: 'tracker.ali213.net' (来自: http://tracker.ali213.net00/announce)
2026-02-13 01:20:33,439 - WARNING - 清理后的主机名 'tracker_proxy' 不符合基本域名结构 (来自: udp://tracker_proxy:66/announce)
2026-02-13 01:20:33,439 - INFO - 检测到并移除隐式端口 '00' from hostname 'tracker.merded.xyz00'. 使用: 'tracker.merded.xyz' (来自: http://tracker.merded.xyz00/announce)
2026-02-13 01:20:33,440 - WARNING - 清理后的主机名 'tracker_proxy' 不符合基本域名结构 (来自: udp://tracker_proxy:65/announce)
2026-02-13 01:20:33,440 - INFO - 检测到并移除隐式端口 '80' from hostname 'tracker.renfei.net80'. 使用: 'tracker.renfei.net' (来自: http://tracker.renfei.net80/announce)
2026-02-13 01:20:33,446 - WARNING - 清理后的主机名 'opentracker.fattydove.i2p' 不符合基本域名结构 (来自: http://opentracker.fattydove.i2p:80/a)
2026-02-13 01:20:33,448 - INFO - 检测到并移除隐式端口 '00' from hostname 'laxclax.ddns.net00'. 使用: 'laxclax.ddns.net' (来自: http://laxclax.ddns.net00/announce)
2026-02-13 01:20:33,449 - INFO - 检测到并移除隐式端口 '80' from hostname 'www.chouchou.club80'. 使用: 'www.chouchou.club' (来自: http://www.chouchou.club80/announce)
2026-02-13 01:20:33,451 - WARNING - 清理后的主机名 'opentracker.skank.i2p' 不符合基本域名结构 (来自: http://opentracker.skank.i2p:80/a)
2026-02-13 01:20:33,455 - INFO - 检测到并移除隐式端口 '80' from hostname 'bt2.54new.com80'. 使用: 'bt2.54new.com' (来自: http://bt2.54new.com80/announce)
2026-02-13 01:20:33,458 - WARNING - 清理后的主机名 'opentracker.dg2.i2p' 不符合基本域名结构 (来自: http://opentracker.dg2.i2p:80/a)
2026-02-13 01:20:33,462 - WARNING - 清理后的主机名 'opentracker.skank.i2p' 不符合基本域名结构 (来自: udp://opentracker.skank.i2p:6969/a)
2026-02-13 01:20:33,462 - WARNING - 清理后的主机名 'tracker_proxy' 不符合基本域名结构 (来自: udp://tracker_proxy:61/announce)
2026-02-13 01:20:33,463 - INFO - 检测到并移除隐式端口 '80' from hostname 'tracker1.itzmx.com80'. 使用: 'tracker1.itzmx.com' (来自: http://tracker1.itzmx.com80/announce)
2026-02-13 01:20:33,463 - WARNING - 清理后的主机名 'opentracker.simp.i2p' 不符合基本域名结构 (来自: udp://opentracker.simp.i2p:6969/a)
2026-02-13 01:20:33,464 - WARNING - 清理后的主机名 '6wbrmd4wodeewdykfw362gmlbeo26njc5zmtuxdvtomehpozzjja.b32.i2p' 不符合基本域名结构 (来自: http://6wbrmd4wodeewdykfw362gmlbeo26njc5zmtuxdvtomehpozzjja.b32.i2p/announce)
2026-02-13 01:20:33,465 - WARNING - 清理后的主机名 'tracker_proxy' 不符合基本域名结构 (来自: udp://tracker_proxy:68/announce)
2026-02-13 01:20:33,466 - WARNING - 清理后的主机名 'tracker_proxy' 不符合基本域名结构 (来自: udp://tracker_proxy:56/announce)
2026-02-13 01:20:33,466 - WARNING - 清理后的主机名 'tracker_proxy' 不符合基本域名结构 (来自: udp://tracker_proxy:62/announce)
2026-02-13 01:20:33,467 - INFO - 检测到并移除隐式端口 '80' from hostname 'tracker.ali213.net80'. 使用: 'tracker.ali213.net' (来自: http://tracker.ali213.net80/announce)
2026-02-13 01:20:33,467 - INFO - 检测到并移除隐式端口 '80' from hostname 'tracker.minglong.org80'. 使用: 'tracker.minglong.org' (来自: http://tracker.minglong.org80/announce)
2026-02-13 01:20:33,469 - WARNING - 清理后的主机名 '4olv65sj4ifeak26wqiifr3q2vjv5d44x733ncqhtd7cmjwoinpa.b32.i2p' 不符合基本域名结构 (来自: http://4olv65sj4ifeak26wqiifr3q2vjv5d44x733ncqhtd7cmjwoinpa.b32.i2p/announce)
2026-02-13 01:20:33,469 - INFO - 检测到并移除隐式端口 '00' from hostname 'bt.ali213.net00'. 使用: 'bt.ali213.net' (来自: http://bt.ali213.net00/announce)
2026-02-13 01:20:33,469 - INFO - 检测到并移除隐式端口 '00' from hostname 'tracker.dmhy.org00'. 使用: 'tracker.dmhy.org' (来自: http://tracker.dmhy.org00/announce)
2026-02-13 01:20:33,471 - WARNING - 清理后的主机名 'opentracker.r4sas.i2p' 不符合基本域名结构 (来自: http://opentracker.r4sas.i2p:80/a)
2026-02-13 01:20:33,473 - WARNING - 清理后的主机名 'tracker_proxy' 不符合基本域名结构 (来自: udp://tracker_proxy:60/announce)
2026-02-13 01:20:33,474 - WARNING - 清理后的主机名 '6wbrmd4wodeewdykfw362gmlbeo26njc5zmtuxdvtomehpozzjja.b32.i2p' 不符合基本域名结构 (来自: http://6wbrmd4wodeewdykfw362gmlbeo26njc5zmtuxdvtomehpozzjja.b32.i2p:80/announce)
2026-02-13 01:20:33,475 - INFO - 检测到并移除隐式端口 '80' from hostname 'bt.ali213.net80'. 使用: 'bt.ali213.net' (来自: http://bt.ali213.net80/announce)
2026-02-13 01:20:33,478 - INFO - 检测到并移除隐式端口 '80' from hostname 'share.camoe.cn80'. 使用: 'share.camoe.cn' (来自: http://share.camoe.cn80/announce)
2026-02-13 01:20:33,482 - WARNING - 清理后的主机名 'tracker_proxy' 不符合基本域名结构 (来自: udp://tracker_proxy:58/announce)
2026-02-13 01:20:33,484 - INFO - 检测到并移除隐式端口 '80' from hostname 'torrentsmd.com80'. 使用: 'torrentsmd.com' (来自: http://torrentsmd.com80/announce)
2026-02-13 01:20:33,487 - WARNING - 清理后的主机名 '{"message"' 不符合基本域名结构 (来自: {"message":)
2026-02-13 01:20:33,487 - INFO - 检测到并移除隐式端口 '80' from hostname 'www.loushao.net80'. 使用: 'www.loushao.net' (来自: http://www.loushao.net80/announce)
2026-02-13 01:20:33,488 - WARNING - 清理后的主机名 'tracker_proxy' 不符合基本域名结构 (来自: udp://tracker_proxy:67/announce)
2026-02-13 01:20:33,491 - WARNING - 清理后的主机名 'tracker_proxy' 不符合基本域名结构 (来自: udp://tracker_proxy:63/announce)
2026-02-13 01:20:33,493 - INFO - 检测到并移除隐式端口 '70' from hostname 'tr.cili001.com70'. 使用: 'tr.cili001.com' (来自: http://tr.cili001.com70/announce)
2026-02-13 01:20:33,493 - WARNING - 清理后的主机名 'tracker_proxy' 不符合基本域名结构 (来自: udp://tracker_proxy:64/announce)
2026-02-13 01:20:33,494 - INFO - 检测到并移除隐式端口 '80' from hostname 'tracker3.ctix.cn80'. 使用: 'tracker3.ctix.cn' (来自: http://tracker3.ctix.cn80/announce)
2026-02-13 01:20:33,495 - INFO - 处理完成 3774 个唯一原始条目
2026-02-13 01:20:33,495 - INFO - 本次运行提取到 1249 个唯一域名和 922 个唯一 IP 地址
2026-02-13 01:20:33,495 - INFO - 发现 2 个新域名
2026-02-13 01:20:33,495 - INFO - 发现 9 个新 IP 地址
2026-02-13 01:20:33,496 - INFO - 向 bt-site.txt 增量添加了 2 个条目
2026-02-13 01:20:33,496 - INFO - 向 bt-ip.txt 增量添加了 9 个条目
2026-02-13 01:20:33,496 - INFO - 成功覆盖写入 bt-site.json (包含 1249 条目)
2026-02-13 01:20:33,497 - INFO - 成功覆盖写入 bt-ip.json (包含 924 条目)
2026-02-13 01:20:33,497 - INFO - --- 运行总结 ---
2026-02-13 01:20:33,497 - INFO - --- 运行总结 (2026-02-13 01:20:33) ---
2026-02-13 01:20:33,497 - INFO - 总耗时: 0:00:18
2026-02-13 01:20:33,497 - INFO - 处理的 URL 数量: 42
2026-02-13 01:20:33,497 - INFO - 收集的原始条目数: 14066 (3774 unique)
2026-02-13 01:20:33,497 - INFO - 提取的唯一域名数 (本次): 2 (总计: 1249)
2026-02-13 01:20:33,497 - INFO -   新增域名: [onioniot.tk, tracker.manager.v6.navy]
2026-02-13 01:20:33,497 - INFO - 提取的唯一 IP 地址数 (本次): 9 (总计: 924)
2026-02-13 01:20:33,497 - INFO -   新增 IP: [179.146.54.147, 191.23.62.111, 180.113.232.20, 91.186.213.204, 180.114.103.80, ...]
2026-02-13 01:20:33,497 - INFO - -------------------------------------
2026-02-13 01:20:33,498 - INFO - 脚本运行成功结束
